<!ELEMENT EMPLOYEES ( EMPLOYEE+ )>
<!ELEMENT EMPLOYEE (NAME,AGE,ADDRESS,PASSWORD)>
<!ELEMENT NAME (#PCDATA)>
<!ELEMENT AGE (#PCDATA)>
<!ELEMENT ADDRESS (#PCDATA)>
<!ELEMENT PASSWORD (#PCDATA)>